{"version":49,"date":"2026-08-19","purpose":"Canonical per-entity dossier migration tranche v49; preserve existing ABox identity and review metadata while materializing dedicated non-State dossier boundaries.","migrationRule":"A migrated non-State entity must point to an existing dedicated type-appropriate dossier. Migration changes dossier placement only and creates no relation, participation, culpability, governance or licensing inference.","visualRule":"Derived visuals render the referenced State dossier context and an identity-boundary evidence flow. State context never becomes an entity-level governance outcome.","maxMissingDedicatedDossiers":0,"entities":[{"id":"PROJECT-UGA-ERIAS-LUKWAGO-2026","name":"Erias Lukwago June 2026 detention and prosecution project","type":"Project","state":"UGA","stateContext":"S","dossier":"dossiers/projects/UGA-ERIAS-LUKWAGO-2026.md","sourceDossier":"dossiers/states/UGA.md","sourceGranularity":"partial","visualModel":{"source":"UGA State dossier + existing ABox identity/review record","proposition":"Dedicated dossier migration preserves Erias Lukwago June 2026 detention and prosecution project as an identity-only non-State record","boundary":"Identity and State-context adjacency do not establish participation, control, culpability or governance"},"visuals":["dossiers/assets/generated/PROJECT-UGA-ERIAS-LUKWAGO-2026-status.svg","dossiers/assets/generated/PROJECT-UGA-ERIAS-LUKWAGO-2026-evidence.svg"]},{"id":"PROJECT-UZB-JAVOKHIR-MUMINOV-2026","name":"Javokhir Muminov June 2026 detention/prosecution project","type":"Project","state":"UZB","stateContext":"S","dossier":"dossiers/projects/UZB-JAVOKHIR-MUMINOV-2026.md","sourceDossier":"dossiers/states/UZB.md","sourceGranularity":"partial","visualModel":{"source":"UZB State dossier + existing ABox identity/review record","proposition":"Dedicated dossier migration preserves Javokhir Muminov June 2026 detention/prosecution project as an identity-only non-State record","boundary":"Identity and State-context adjacency do not establish participation, control, culpability or governance"},"visuals":["dossiers/assets/generated/PROJECT-UZB-JAVOKHIR-MUMINOV-2026-status.svg","dossiers/assets/generated/PROJECT-UZB-JAVOKHIR-MUMINOV-2026-evidence.svg"]},{"id":"PROJECT-ZMB-PECA-ENFORCEMENT","name":"Zambia Cyber Crimes Act No. 4 of 2025 enforcement project","type":"Project","state":"ZMB","stateContext":"S","dossier":"dossiers/projects/ZMB-PECA-ENFORCEMENT.md","sourceDossier":"dossiers/states/ZMB.md","sourceGranularity":"partial","visualModel":{"source":"ZMB State dossier + existing ABox identity/review record","proposition":"Dedicated dossier migration preserves Zambia Cyber Crimes Act No. 4 of 2025 enforcement project as an identity-only non-State record","boundary":"Identity and State-context adjacency do not establish participation, control, culpability or governance"},"visuals":["dossiers/assets/generated/PROJECT-ZMB-PECA-ENFORCEMENT-status.svg","dossiers/assets/generated/PROJECT-ZMB-PECA-ENFORCEMENT-evidence.svg"]},{"id":"PROJECT-ZMB-XAVIER-CHUNGU-DETENTION","name":"Xavier Chungu State-security/sedition detention case","type":"Project","state":"ZMB","stateContext":"S","dossier":"dossiers/projects/ZMB-XAVIER-CHUNGU-DETENTION.md","sourceDossier":"dossiers/states/ZMB.md","sourceGranularity":"partial","visualModel":{"source":"ZMB State dossier + existing ABox identity/review record","proposition":"Dedicated dossier migration preserves Xavier Chungu State-security/sedition detention case as an identity-only non-State record","boundary":"Identity and State-context adjacency do not establish participation, control, culpability or governance"},"visuals":["dossiers/assets/generated/PROJECT-ZMB-XAVIER-CHUNGU-DETENTION-status.svg","dossiers/assets/generated/PROJECT-ZMB-XAVIER-CHUNGU-DETENTION-evidence.svg"]}]}
