{"version":46,"date":"2026-08-19","purpose":"Canonical per-entity dossier migration tranche v46; preserve existing ABox identity and review metadata while materializing dedicated non-State dossier boundaries.","migrationRule":"A migrated non-State entity must point to an existing dedicated type-appropriate dossier. Migration changes dossier placement only and creates no relation, participation, culpability, governance or licensing inference.","visualRule":"Derived visuals render the referenced State dossier context and an identity-boundary evidence flow. State context never becomes an entity-level governance outcome.","maxMissingDedicatedDossiers":14,"entities":[{"id":"PROJECT-ECU-EXTERMINIO-TOTAL","name":"Exterminio Total","type":"Project","state":"ECU","stateContext":"S","dossier":"dossiers/projects/ECU-EXTERMINIO-TOTAL.md","sourceDossier":"dossiers/states/ECU.md","sourceGranularity":"partial","visualModel":{"source":"ECU State dossier + existing ABox identity/review record","proposition":"Dedicated dossier migration preserves Exterminio Total as an identity-only non-State record","boundary":"Identity and State-context adjacency do not establish participation, control, culpability or governance"},"visuals":["dossiers/assets/generated/PROJECT-ECU-EXTERMINIO-TOTAL-status.svg","dossiers/assets/generated/PROJECT-ECU-EXTERMINIO-TOTAL-evidence.svg"]},{"id":"PROJECT-ETH-ADDIS-ABABA-CORRIDOR-DEVELOPMENT","name":"Addis Ababa Corridor Development Project","type":"Project","state":"ETH","stateContext":"S","dossier":"dossiers/projects/ETH-ADDIS-ABABA-CORRIDOR-DEVELOPMENT.md","sourceDossier":"dossiers/states/ETH.md","sourceGranularity":"partial","visualModel":{"source":"ETH State dossier + existing ABox identity/review record","proposition":"Dedicated dossier migration preserves Addis Ababa Corridor Development Project as an identity-only non-State record","boundary":"Identity and State-context adjacency do not establish participation, control, culpability or governance"},"visuals":["dossiers/assets/generated/PROJECT-ETH-ADDIS-ABABA-CORRIDOR-DEVELOPMENT-status.svg","dossiers/assets/generated/PROJECT-ETH-ADDIS-ABABA-CORRIDOR-DEVELOPMENT-evidence.svg"]},{"id":"PROJECT-FJI-VAKARISI-CUSTODY-2026-04","name":"16-17 April 2026 Jone Vakarisi military-custody incident","type":"Project","state":"FJI","stateContext":"U","dossier":"dossiers/projects/FJI-VAKARISI-CUSTODY-2026-04.md","sourceDossier":"dossiers/states/FJI.md","sourceGranularity":"partial","visualModel":{"source":"FJI State dossier + existing ABox identity/review record","proposition":"Dedicated dossier migration preserves 16-17 April 2026 Jone Vakarisi military-custody incident as an identity-only non-State record","boundary":"Identity and State-context adjacency do not establish participation, control, culpability or governance"},"visuals":["dossiers/assets/generated/PROJECT-FJI-VAKARISI-CUSTODY-2026-04-status.svg","dossiers/assets/generated/PROJECT-FJI-VAKARISI-CUSTODY-2026-04-evidence.svg"]},{"id":"PROJECT-GAB-PLATFORM-SUSPENSION-2026-02-26","name":"Gabon 26 February 2026 digital-platform suspension project","type":"Project","state":"GAB","stateContext":"S","dossier":"dossiers/projects/GAB-PLATFORM-SUSPENSION-2026-02-26.md","sourceDossier":"dossiers/states/GAB.md","sourceGranularity":"partial","visualModel":{"source":"GAB State dossier + existing ABox identity/review record","proposition":"Dedicated dossier migration preserves Gabon 26 February 2026 digital-platform suspension project as an identity-only non-State record","boundary":"Identity and State-context adjacency do not establish participation, control, culpability or governance"},"visuals":["dossiers/assets/generated/PROJECT-GAB-PLATFORM-SUSPENSION-2026-02-26-status.svg","dossiers/assets/generated/PROJECT-GAB-PLATFORM-SUSPENSION-2026-02-26-evidence.svg"]},{"id":"PROJECT-GBR-PALESTINE-ACTION-PROSCRIPTION-ENFORCEMENT","name":"Palestine Action proscription enforcement project","type":"Project","state":"GBR","stateContext":"S","dossier":"dossiers/projects/GBR-PALESTINE-ACTION-PROSCRIPTION-ENFORCEMENT.md","sourceDossier":"dossiers/states/GBR.md","sourceGranularity":"partial","visualModel":{"source":"GBR State dossier + existing ABox identity/review record","proposition":"Dedicated dossier migration preserves Palestine Action proscription enforcement project as an identity-only non-State record","boundary":"Identity and State-context adjacency do not establish participation, control, culpability or governance"},"visuals":["dossiers/assets/generated/PROJECT-GBR-PALESTINE-ACTION-PROSCRIPTION-ENFORCEMENT-status.svg","dossiers/assets/generated/PROJECT-GBR-PALESTINE-ACTION-PROSCRIPTION-ENFORCEMENT-evidence.svg"]}]}
